{
  "all_preflights_passed": true,
  "candidate_child_seeds": [
    11661666064119480592,
    10743510066261649426,
    6534260988641411628,
    5360733584521491648,
    2496215248607298552,
    101206370414863479,
    3709976053787852381,
    7797986099714834301,
    961614365100002671,
    17868664834800568065,
    11465761185334612822,
    17096916718093319791,
    4504810251867244694,
    9192934870963826683,
    9621427833050879063,
    9363620560282458497,
    12637529755677670284,
    11839355831036948626,
    640457575788724086,
    256251957753453425,
    14429372166053887084,
    7949502304107944964,
    1163405233188355681,
    5327807001574392714,
    13443613268464860486,
    4104459640181417425,
    2583369449223844159,
    7332430829464094573,
    16620342754278385572,
    16577984565601413805,
    17944308096087194444,
    7469557046758967716
  ],
  "candidate_count": 32,
  "candidate_minimum_distances": [
    0.03114151244615866,
    0.01601671750128214,
    0.03155944259286939,
    0.035259819967303506,
    0.017136277982360948,
    0.020776050791805247,
    0.0213670425268585,
    0.022415553627351856,
    0.032353859157420645,
    0.02081355809050678,
    0.03666928448214767,
    0.034902753527439864,
    0.014906254978227661,
    0.030083936355811195,
    0.01861432340289935,
    0.022035144845387294,
    0.03303637426244273,
    0.021698178378869133,
    0.027333674266823673,
    0.027303583208473807,
    0.02551399065415154,
    0.025127694856903568,
    0.031622554924837135,
    0.031525806919823325,
    0.028161528208239178,
    0.0241214749280362,
    0.01851392884267994,
    0.028020843716597656,
    0.024594548233519767,
    0.02136306039704146,
    0.027295203606208126,
    0.025843764773944188
  ],
  "candidate_seeds_sha256": "3a742d5398c7134219807743428650bd1a4a6b5750c10f6839a893a2e0ae8b01",
  "config_sha256": "04ffaf7dcb027482d82c921fa617a429872a06e5d0a92545e3cfaf724a011333",
  "design_sha256": "352a060bdb7ef2ff3e9432d7eff4333d6d3c9bd9aca33c6f29f6f56a307250c1",
  "dimension_statistics": {
    "aspect_ratio": {
      "maximum": 0.999734423954526,
      "mean": 0.7499969855847765,
      "minimum": 0.5003955989686888,
      "q05": 0.5253324776270177,
      "q25": 0.6252127310317399,
      "q50": 0.7499756573000859,
      "q75": 0.8746797132891131,
      "q95": 0.9746447320331376
    },
    "reynolds": {
      "maximum": 299.9791306569752,
      "mean": 170.00493005620066,
      "minimum": 40.08764472776586,
      "q05": 53.14905015591503,
      "q25": 105.05061123709513,
      "q50": 169.98391539839713,
      "q75": 234.95159987255724,
      "q95": 286.92194810177574
    },
    "rotation_deg": {
      "maximum": 29.980696634335786,
      "mean": 15.00018471685028,
      "minimum": 0.024617303384732808,
      "q05": 1.5162357773955735,
      "q25": 7.51027566550578,
      "q50": 14.990508492608699,
      "q75": 22.50299520922452,
      "q95": 28.491437003955674
    },
    "scale": {
      "maximum": 1.2495004123786677,
      "mean": 0.9999908373891915,
      "minimum": 0.7503062837226571,
      "q05": 0.7754049285710114,
      "q25": 0.8752583043717439,
      "q50": 0.9997869453995569,
      "q75": 1.124924818119975,
      "q95": 1.224992831112415
    }
  },
  "dimensions": [
    "aspect_ratio",
    "rotation_deg",
    "scale",
    "reynolds"
  ],
  "geometry_preflight_passed": 1000,
  "lattice_preflight_passed": 1000,
  "name": "mvp-v1",
  "nearest_neighbor_distance": {
    "maximum": 0.23514340821719676,
    "mean": 0.11470033201841506,
    "minimum": 0.03666928448214767,
    "q05": 0.06149777233087328,
    "q25": 0.09149174100479504,
    "q50": 0.11491947804029035,
    "q75": 0.13643095588464793,
    "q95": 0.17146885804164622
  },
  "pairwise_correlation": [
    [
      1.0,
      -0.005155470886759523,
      0.02604688999326078,
      0.006077917308247481
    ],
    [
      -0.005155470886759523,
      1.0,
      -0.03977337649914379,
      0.019798874883326992
    ],
    [
      0.02604688999326078,
      -0.039773376499143795,
      0.9999999999999998,
      -0.02777700876646531
    ],
    [
      0.006077917308247481,
      0.019798874883326992,
      -0.02777700876646531,
      1.0
    ]
  ],
  "samples": 1000,
  "schema_version": 1,
  "seed": 20260901,
  "selected_candidate_index": 10,
  "selected_minimum_distance": 0.03666928448214767,
  "split_counts": {
    "test": 200,
    "train": 600,
    "validation": 200
  },
  "split_sha256": "406a35bdef46cd10e77efc7fc6b301ffbb089783c2454dc86c8308a093e9d027"
}
